<?xml version="1.0" encoding="UTF-8"?>
<!--Sample XML file generated by XMLSpy v2006 rel. 3 sp1 (http://www.altova.com)-->
<dbconfig xmlns:xsi="http://www.w3.org/2001/XMLSchema-instance" xsi:noNamespaceSchemaLocation="C:\Users\Yashasvi\Downloads\ColumnStore_ReferenceImplementation\ColumnStore\src\dbconfig.xsd">
	<dbname>testdb</dbname>
	<projectionList>
		<projection>
			<projName>employee</projName>
			<anchorTable>employee</anchorTable>
			<columnList>
				<column>
					<colURI>testdb.employee.id</colURI>
					<filePath>C:\\Users\\Yashasvi\\Downloads\\ColumnStore_ReferenceImplementation\\ColumnStore\\testdb\\id.dat</filePath>
					<dataType>stringColumn</dataType>
				</column>
				<column>
					<colURI>testdb.employee.name</colURI>
					<filePath>C:\\Users\\Yashasvi\\Downloads\\ColumnStore_ReferenceImplementation\\ColumnStore\\testdb\\name.dat</filePath>
					<dataType>stringColumn</dataType>
				</column>
				<column>
					<colURI>testdb.employee.age</colURI>
					<filePath>C:\\Users\\Yashasvi\\Downloads\\ColumnStore_ReferenceImplementation\\ColumnStore\\testdb\\age.dat</filePath>
					<dataType>numberColumn</dataType>
				</column>
				<column>
					<colURI>testdb.employee.salary</colURI>
					<filePath>C:\\Users\\Yashasvi\\Downloads\\ColumnStore_ReferenceImplementation\\ColumnStore\\testdb\\salary.dat</filePath>
					<dataType>numberColumn</dataType>
				</column>
			</columnList>
			<sortKey>
				<colURI>testdb.employee.id</colURI>
			</sortKey>
		</projection>
	</projectionList>
</dbconfig>
